{
  "eventId": "a1b2c3d4-e5f6-7890-abcd-ef1234567890",
  "eventType": "PNRCreated",
  "schemaVersion": 1,
  "tenantId": "11111111-1111-1111-1111-111111111111",
  "corporateId": "22222222-2222-2222-2222-222222222222",
  "sourceService": "hci\\.itinerary",
  "timestamp": "2026-06-01T10:00:00.000Z",
  "correlationId": "33333333-3333-3333-3333-333333333333",
  "payload": {}
}
