{
  "eventId": "c9d0e1f2-a3b4-5678-cdef-789012345678",
  "eventType": "TravellerCreated",
  "schemaVersion": 1,
  "tenantId": "11111111-1111-1111-1111-111111111111",
  "corporateId": "22222222-2222-2222-2222-222222222222",
  "sourceService": "hci\\.itinerary",
  "timestamp": "2026-06-01T09:55:00.000Z",
  "correlationId": "33333333-3333-3333-3333-333333333333",
  "payload": {
    "travellerId": "55555555-5555-5555-5555-555555555555",
    "employeeNumber": "EMP-12345",
    "email": "jane.smith@acmecorp.com",
    "firstName": "Jane",
    "lastName": "Smith",
    "corporateId": "22222222-2222-2222-2222-222222222222",
    "status": "active"
  }
}
