{
  "eventId": "b8c9d0e1-f2a3-4567-bcde-678901234567",
  "eventType": "SegmentRemoved",
  "schemaVersion": 1,
  "tenantId": "11111111-1111-1111-1111-111111111111",
  "corporateId": "22222222-2222-2222-2222-222222222222",
  "sourceService": "hci\\.itinerary",
  "timestamp": "2026-06-06T16:00:00.000Z",
  "correlationId": "33333333-3333-3333-3333-333333333333",
  "payload": {
    "segmentId": "99999999-9999-9999-9999-999999999999",
    "tripId": "66666666-6666-6666-6666-666666666666",
    "segmentType": "hotel",
    "departureDateTime": "2026-06-15T15:00:00.000Z",
    "arrivalDateTime": "2026-06-19T11:00:00.000Z",
    "origin": "New York",
    "destination": "New York",
    "supplierCode": null,
    "status": "cancelled",
    "typeSpecificData": {
      "propertyName": "Marriott Marquis Times Square",
      "propertyCode": "NYCMQ",
      "chainCode": "MC",
      "checkInDate": "2026-06-15T15:00:00.000Z",
      "checkOutDate": "2026-06-19T11:00:00.000Z",
      "roomNights": 4,
      "rateCode": "CORP01",
      "city": "New York",
      "country": "US"
    }
  }
}
