{
  "eventId": "d4e5f6a7-b8c9-0123-defa-234567890123",
  "eventType": "TripUpdated",
  "schemaVersion": 1,
  "tenantId": "11111111-1111-1111-1111-111111111111",
  "corporateId": "22222222-2222-2222-2222-222222222222",
  "sourceService": "hci\\.itinerary",
  "timestamp": "2026-06-03T11:00:00.000Z",
  "correlationId": "33333333-3333-3333-3333-333333333333",
  "payload": {
    "tripId": "66666666-6666-6666-6666-666666666666",
    "travellerId": "55555555-5555-5555-5555-555555555555",
    "status": "active",
    "departureDate": "2026-06-15T08:00:00.000Z",
    "returnDate": "2026-06-20T18:00:00.000Z",
    "origin": "LHR",
    "destination": "JFK",
    "isInternational": true,
    "segmentIds": [
      "77777777-7777-7777-7777-777777777777",
      "88888888-8888-8888-8888-888888888888",
      "99999999-9999-9999-9999-999999999999"
    ]
  }
}
