{
  "eventId": "a1b2c3d4-e5f6-7890-abcd-ef1234567890",
  "eventType": "PNRCreated",
  "schemaVersion": 1,
  "tenantId": "11111111-1111-1111-1111-111111111111",
  "corporateId": "22222222-2222-2222-2222-222222222222",
  "sourceService": "hci\\.itinerary",
  "timestamp": "2026-06-01T10:00:00.000Z",
  "correlationId": "33333333-3333-3333-3333-333333333333",
  "payload": {
    "pnrId": "44444444-4444-4444-4444-444444444444",
    "recordLocator": "ABC123",
    "travellerId": "55555555-5555-5555-5555-555555555555",
    "tripId": "66666666-6666-6666-6666-666666666666",
    "gdsSource": "Amadeus",
    "createdAt": "2026-06-01T09:30:00.000Z",
    "segmentCount": 3,
    "rawPnrRef": "s3://hci-raw-pnrs/2026/06/01/ABC123.json"
  }
}
